GRUPO;CONSULTA_PORTAL;TIPO_CONSULTA;FILTRO;CAMPO_PORTAL;VOCE_ESTA_AQUI;PERMITE_SELECAO;PERMITE_CLIQUE;POSSUI_TOOTIP;TOOLTIP_DESCRICAO_PORTAL;OBSERVACAO;ORIGEM_DADOS;CAMPO_ORIGEM_DADOS;DIMENSAO_ORIGEM_DADOS;TOOLTIP_ORIGEM_DADOS;PERIODICIDADE_ATUALIZACAO_PORTAL;FREQUENCIA_ATUALIZACAO_PORTAL;HORARIO_ATUALIZACAO_PORTAL
Despesas;mapa de investimento;Pesquisa Básica;;Ano;;sim;não;não;;-;armazém SIAFI;Ano de exercício;Período Contábil ;;Diária;Terça a Sábado;Entre 4:30h a 5:30h
Despesas;mapa de investimento;Pesquisa Básica;;Inicio/Fim;;sim;não;não;;-;armazém SIAFI;Mês - Númerico;Período Contábil ;;Diária;Terça a Sábado;Entre 4:30h a 5:30h
Despesas;mapa de investimento;Pesquisa Básica;;Município;;não;não;sim;Município para onde foi destinado o investimento - compras de equipamentos, material permanente e realização de obras, diretamente pelo Estado ou por meio de repasses de recursos.;-;armazém SIAFI;Município - Descrição;Execução Orçamentária da Despesa >> Execução de Investimento Regionalizado >> Dados da Execução - Regionalizado;;Diária;Terça a Sábado;Entre 4:30h a 5:30h
Despesas;mapa de investimento;Pesquisa Básica;;Órgão;;não;não;sim;Nome da unidade orçamentária que realizou a despesa de investimento.;-;armazém SIAFI;Unidade Orçamentária - nome;Unidade Orçamentária;;Diária;Terça a Sábado;Entre 4:30h a 5:30h
Despesas;mapa de investimento;Pesquisa Básica;;Item de Despesa;;não;não;sim;Descrição do tipo de despesa de investimento realizada. Exemplos: execução de obras, equipamentos de informática, mobiliário, veículos, etc. ;-;armazém SIAFI;Item Despesa - Descrição;Execução Orçamentária da Despesa >> Execução de Investimento Regionalizado >> Natureza da Despesa- Regionalizado;;Diária;Terça a Sábado;Entre 4:30h a 5:30h
Despesas;mapa de investimento;Pesquisa Básica;;Valor Investido;;não;não;sim;Valor em reais de despesa liquidada referente a investimento - compras de equipamentos, material permantente e realizações de obras diretamente pelo estado ou por meio de repasses de recursos.;-;armazém SIAFI;Valor Investido;Execução Orçamentária da Despesa >> Execução de Investimento Regionalizado;;Diária;Terça a Sábado;Entre 4:30h a 5:30h
